{
  "schema_version": "1.0.0",
  "generated_at": "2026-10-18T11:13:53.986049+09:00",
  "last_success_at": null,
  "data_status": "partial",
  "sources": [
    {
      "id": "gg",
      "name": "경기도 장애인 특별공급",
      "url": "https://www.gg.go.kr/bbs/board.do?bsIdx=504&menuId=1878",
      "status": "partial",
      "checked_at": "2026-10-18T11:10:19.533159+09:00",
      "last_success_at": null,
      "error_code": "notice_or_attachment_failed",
      "message": "notice_or_attachment_failed",
      "records_count": 37
    },
    {
      "id": "applyhome",
      "name": "청약홈 분양정보",
      "url": "https://www.data.go.kr/data/15098547/openapi.do",
      "status": "not_configured",
      "checked_at": "2026-10-18T11:10:19.533159+09:00",
      "last_success_at": null,
      "error_code": "official_project_mapping_required",
      "message": "official_project_mapping_required",
      "records_count": 0
    },
    {
      "id": "molit",
      "name": "국토교통부 실거래가",
      "url": "https://www.data.go.kr/data/15126469/openapi.do",
      "status": "not_configured",
      "checked_at": "2026-10-18T11:10:19.533159+09:00",
      "last_success_at": null,
      "error_code": "missing_molit_key",
      "message": "missing_molit_key",
      "records_count": 0
    }
  ],
  "listings": [
    {
      "id": "gg_269252265",
      "name": "아르뮤제이",
      "address": "경기도 안산시 상록구 성포동 586번지",
      "region": "안산시",
      "district": "상록구",
      "housing_type": "unknown",
      "status": "upcoming",
      "apply_start_at": "2026-10-27T09:00:00+09:00",
      "apply_end_at": "2026-11-02T18:00:00+09:00",
      "deadline_note": null,
      "notice_url": "https://www.gg.go.kr/bbs/boardView.do?bsIdx=504&menuId=1878&bIdx=269252265",
      "notice_updated_at": "2026-10-16",
      "updated_at": "2026-10-18T11:10:19.533159+09:00",
      "eligibility": {
        "yongin_status": "eligible",
        "disability_scope": "both",
        "evidence_url": "https://www.gg.go.kr/bbs/boardView.do?bsIdx=504&menuId=1878&bIdx=269252265",
        "evidence_text": "○ 신청자격 : 신청일 당시 경기도 거주 만19세 이상 무주택 세대구성원 장애인",
        "scoring_note": "장애 정도 배점과 신청 제한은 별개이며 개인별 최종 자격을 보장하지 않습니다.",
        "conditions": [
          "신청일 당시 경기도 거주 만19세 이상 무주택 세대구성원 장애인"
        ],
        "rule_version": "1.0.0"
      },
      "units": [],
      "attachments": [
        {
          "url": "https://www.gg.go.kr/cmmn/download.do?idx=904209",
          "name": "붙임2) 안산 「아르뮤제이」 장애인 특별공급 안내 및 관련서식.hwpx",
          "parse_status": "parsed",
          "error_code": null
        },
        {
          "url": "https://www.gg.go.kr/cmmn/download.do?idx=904210",
          "name": "붙임3) 아르뮤제자이_특별공급 기관추천 안내문.pdf",
          "parse_status": "parsed",
          "error_code": null
        }
      ],
      "notice_history": [
        {
          "notice_url": "https://www.gg.go.kr/bbs/boardView.do?bsIdx=504&menuId=1878&bIdx=269252265",
          "published_on": "2026-10-16",
          "content_sha256": "26b29e3c21bbb8120463969583431ec7442d176b94dc14e9702878214ff43f06",
          "observed_at": "2026-10-18T11:10:19.533159+09:00",
          "change_type": "initial"
        }
      ],
      "housing_manage_no": null,
      "pblanc_no": null,
      "location_verified": false,
      "collection_issues": [
        "attachment_structured_review_required",
        "official_project_mapping_required"
      ]
    }
  ]
}
